{
  "$schema": "https://json-schema.org/draft/2020-12/schema",
  "$id": "https://sma/schemas/reuse-receipt.schema.json",
  "title": "SMA Reuse Receipt",
  "description": "This schema defines the receipt produced when a brick or build is copied into another project, including saved effort, adaptations, and inherited backlog. Project maintainers, auditors, and reuse tooling need it after every clone or manual reuse operation. Read it before reporting reuse savings or handing inherited imperfections to the target team. Remember that the receipt records both the benefit and the debt transferred with the reused work.",
  "type": "object",
  "required": [
    "schema_version",
    "id",
    "generated_at",
    "source",
    "target",
    "items",
    "estimates"
  ],
  "properties": {
    "schema_version": {
      "const": "1.0.0",
      "description": "Schema version that this document conforms to."
    },
    "id": {
      "type": "string",
      "description": "Stable id for this receipt: <target_project>:<source_project>@<commit>:<iso8601>"
    },
    "generated_at": {
      "type": "string",
      "description": "Time when this document was generated, in ISO 8601 date-time format.",
      "format": "date-time"
    },
    "source": {
      "type": "object",
      "description": "Fields that describe the source.",
      "required": [
        "project",
        "commit"
      ],
      "properties": {
        "project": {
          "type": "string",
          "description": "Project identifier associated with the source."
        },
        "commit": {
          "type": "string",
          "description": "Git commit identifier associated with the recorded work."
        },
        "registry_path": {
          "type": "string",
          "description": "Path to the source SMA scan registry, if available."
        }
      }
    },
    "target": {
      "type": "object",
      "description": "Fields that describe the target.",
      "required": [
        "project",
        "root"
      ],
      "properties": {
        "project": {
          "type": "string",
          "description": "Project identifier associated with the target."
        },
        "root": {
          "type": "string",
          "description": "Repository root represented by this record."
        },
        "commit": {
          "type": "string",
          "description": "Git commit identifier associated with the recorded work."
        }
      }
    },
    "items": {
      "type": "array",
      "description": "One entry per inherited brick or build.",
      "items": {
        "type": "object",
        "required": [
          "source_brick_id",
          "target_path",
          "kind",
          "loc",
          "files"
        ],
        "properties": {
          "source_brick_id": {
            "type": "string",
            "description": "Recorded source brick identifier for the items."
          },
          "target_brick_id": {
            "type": "string",
            "description": "Recorded target brick identifier for the items."
          },
          "target_path": {
            "type": "string",
            "description": "Repository-relative destination path for the placed file or directory."
          },
          "kind": {
            "enum": [
              "brick",
              "build",
              "service",
              "module",
              "component",
              "hook",
              "utility",
              "schema"
            ],
            "description": "Classification assigned to the record."
          },
          "loc": {
            "type": "integer",
            "description": "Loc as a whole number for the record.",
            "minimum": 0
          },
          "files": {
            "type": "integer",
            "description": "Files as a whole number for the record.",
            "minimum": 0
          },
          "token_estimate": {
            "type": "integer",
            "description": "Token estimate as a whole number for the record.",
            "minimum": 0
          },
          "modified_after_clone": {
            "type": "object",
            "description": "Fields that describe the modified after clone.",
            "properties": {
              "loc_added": {
                "type": "integer",
                "description": "Loc added as a whole number for the modified after clone."
              },
              "loc_removed": {
                "type": "integer",
                "description": "Loc removed as a whole number for the modified after clone."
              },
              "files_changed": {
                "type": "integer",
                "description": "Files changed as a whole number for the modified after clone."
              }
            }
          }
        }
      }
    },
    "estimates": {
      "type": "object",
      "description": "Fields that describe the estimates.",
      "required": [
        "loc_inherited_total",
        "tokens_saved_estimate"
      ],
      "properties": {
        "loc_inherited_total": {
          "type": "integer",
          "description": "Loc inherited total as a whole number for the estimate."
        },
        "tokens_saved_estimate": {
          "type": "object",
          "description": "Fields that describe the tokens saved estimate.",
          "required": [
            "lower",
            "upper",
            "method"
          ],
          "properties": {
            "lower": {
              "type": "integer",
              "description": "Lower as a whole number for the tokens saved estimate."
            },
            "upper": {
              "type": "integer",
              "description": "Upper as a whole number for the tokens saved estimate."
            },
            "method": {
              "type": "string",
              "description": "How the estimate was computed (heuristic, BPE-counted, billed-tokens-from-anthropic-receipts, etc.)"
            },
            "factors": {
              "type": "object",
              "description": "Per-factor breakdown: direct_generation, iteration_roundtrips, design_discussion, etc.",
              "additionalProperties": {
                "type": "integer"
              }
            }
          }
        },
        "infrastructure_cost_tokens": {
          "type": "integer",
          "description": "Tokens spent in this session to ingest the bricks (read manifests, patch imports, write shims). Net savings = saved - infrastructure."
        },
        "wall_clock_minutes_saved_estimate": {
          "type": "integer",
          "description": "Wall clock minutes saved estimate as a whole number for the estimate."
        }
      }
    },
    "backlog_entry_ids": {
      "type": "array",
      "items": {
        "type": "string"
      },
      "description": "Backlog ids opened in the TARGET project for imperfections in the inherited bricks (e.g. typecheck disabled, missing types, dependency drift)."
    },
    "provenance": {
      "type": "object",
      "description": "Evidence describing where the content came from and who changed it.",
      "properties": {
        "actor_kind": {
          "enum": [
            "human",
            "ai_model",
            "automation"
          ],
          "description": "Category of actor that performed the action."
        },
        "actor_id": {
          "type": "string",
          "description": "Identifier of the human, agent, automation, or tool that performed the action."
        },
        "model": {
          "type": "string",
          "description": "Model identifier recorded for an AI-driven actor."
        },
        "session_id": {
          "type": "string",
          "description": "Identifier of the agent session that produced this value."
        }
      }
    }
  }
}
